{"collection_affecting_paths":["pyproject.toml"],"collection_policy":"double_fresh_collection_exact_match","expected_mandatory_collection_identity":"8937799ed8717bc9b6bc9928f91650f5d6618c84e75e94ab8a32b51485838528","expected_mandatory_node_count":302,"launch_smoke_selectors":[],"policy_identifier":"experiment-execution-readiness-v1.1-tests-v1","policy_identity":"83c1a18f525567e3ebde49a8e3f1e67199d1b89bc7c0e8ee9b91442180a4d407","required_selectors":["tests/execution/test_attempts.py","tests/execution/test_control_storage.py","tests/execution/test_orchestrator.py","tests/execution/test_outcome_gate.py","tests/execution/test_phase3c_schema_registry.py","tests/execution/test_readiness_mandatory_v1.py"],"result_policy":"all_collected_nodes_pass","schema_version":2,"warning_policy":"reject_any_warning"}
